{
  "schemaVersion": "0.3",
  "runId": "RUN-20260515-110000",
  "projectId": "PROJECT_USER_MANAGEMENT",
  "executionPlanId": "PLAN_TC_001_001",
  "tcId": "TC_001-001",
  "startedAt": "2026-05-15T11:00:00+09:00",
  "endedAt": "2026-05-15T11:01:20+09:00",
  "environment": {
    "environmentType": "staging",
    "baseUrl": "https://example.com/admin",
    "browser": "chromium",
    "headless": false,
    "appVersion": "0.1.0"
  },
  "summary": {
    "totalSteps": 5,
    "passedSteps": 5,
    "failedSteps": 0,
    "skippedSteps": 0,
    "executionStatus": "COMPLETED",
    "testResult": "P",
    "durationMs": 80000
  },
  "stepResults": [
    {
      "stepId": "STEP_001",
      "status": "PASSED",
      "startedAt": "2026-05-15T11:00:05+09:00",
      "endedAt": "2026-05-15T11:00:08+09:00",
      "message": "등록 버튼 클릭 완료",
      "currentUrl": "https://example.com/admin/users/new",
      "pageStateId": "PAGE_002",
      "resolveAttempts": [
        { "selectorType": "testId", "selector": "[data-testid='create-user']", "result": "FOUND" }
      ]
    },
    {
      "stepId": "ASSERT_001",
      "status": "PASSED",
      "startedAt": "2026-05-15T11:01:15+09:00",
      "endedAt": "2026-05-15T11:01:18+09:00",
      "message": "사용자 목록에 신규 사용자명 표시 확인"
    }
  ],
  "assertionResults": [
    {
      "stepId": "ASSERT_001",
      "assertion": "assertRowContains",
      "passed": true,
      "expected": "자동테스트사용자",
      "actual": "자동테스트사용자",
      "message": "테이블 행에 등록한 사용자명이 표시됨"
    }
  ],
  "createdDataRegistryId": "CDR_001",
  "evidence": {
    "screenshots": ["evidence/STEP_001.png", "evidence/ASSERT_001.png"],
    "videos": [],
    "logs": ["logs/RUN-20260515-110000.log"]
  },
  "testDataSnapshotId": "SNAP_001"
}
